{
  "core_message": {
    "primary_thesis": "As hyperscalers build custom AI ASIC stacks to escape 'the Nvidia tax', a distinct class of specialist suppliers—the 'shadow winners' (design/IP houses, connectivity providers, power/cooling vendors, and advanced packagers/foundries)—will capture outsized, durable value.",
    "secondary_messages": [
      "The market is shifting from model training dominance to a much larger inference-driven economy, which favors purpose-built silicon and distributed specialist ecosystems.",
      "'Structural independence' by hyperscalers does not eliminate third parties; it reallocates where and how value accrues—away from general-purpose GPU vendors toward firms that enable custom chip design, interconnect, power delivery, cooling, and packaging.",
      "Hyperscalers will not do all hardware tasks in-house; the modern ASIC value chain is highly segmented, and the firms that provide IP blocks, physical design, retimers/CXL, optical interconnects, PMICs, liquid cooling, substrates and foundry capacity become essential beneficiaries.",
      "Investor strategy should rotate from a singular focus on leading accelerator vendors to owners of the underlying blueprint and supply chain that scale with hyperscaler capex."
    ],
    "reader_implication": "Investors should prioritize exposure to infrastructure suppliers that are causally linked to hyperscaler ASIC deployments (design/IP partners, connectivity vendors, power/cooling specialists, advanced packagers and TSMC) because these firms mechanically monetize hyperscaler moves to bespoke silicon and offer differentiated risk/reward profiles."
  },
  "signature_framing": [
    "Post-NVIDIA: The Hyperscaler Counterattack and the 'Shadow Winners'",
    "Nvidia Tax → Structural Independence",
    "Big tech refuse to remain mere customers—they become chip designers; who then profits from that transition?",
    "Buy the blueprint, not the frontline soldier"
  ],
  "narrative_map": {
    "opening_frame": "NVIDIA’s dominance (H100, Blackwell) has defined AI infrastructure investment through 2023–H1 2024, but a deeper structural shift is underway as hyperscalers move to custom ASICs.",
    "problem_definition": "NVIDIA-centric, general-purpose GPUs impose a high TCO ('Nvidia tax') for hyperscalers whose workloads are inference-heavy and highly repetitive.",
    "structural_shift": "Hyperscalers are pursuing 'structural independence' by designing ASICs (TPU, Trainium, Inferentia, MTIA) to lower TCO, creating demand for specialized suppliers across a segmented value chain.",
    "why_now": "Inference market growth, compiler/portability progress, hyperscaler scale economics, and mounting TCO pressure make ASIC adoption timely; hyperscalers have announced large capex cycles (2025–2026) and concrete programs (e.g., Project Rainier).",
    "development_flow": [
      "Define the inefficiency of general-purpose GPUs (Nvidia Tax) → show economics motivating ASICs",
      "Explain the shift from training to inference and resulting demand dynamics",
      "Map the segmented ecosystem required to realize bespoke ASIC deployments (design/IP, interconnect, power & cooling, packaging & foundry)",
      "Profile companies in each segment that are positioned to capture value",
      "Use Project Rainier and hyperscaler programs as connective tissue to show mechanical revenue flows",
      "Conclude with investment guidance to rotate toward infrastructure suppliers"
    ],
    "closing_logic": "As hyperscalers scale custom ASIC deployments, value will reflow to a repeatable set of specialist vendors. The investment case is to own the suppliers of design IP, interconnect, power/thermal systems, and packaging/foundry capacity—i.e., the shadow winners that monetize every increment of hyperscaler ASIC adoption."
  },
  "hierarchical_structure": {
    "theme": "Hyperscalers' move to custom AI ASICs creates enduring winners among specialist suppliers across the ASIC value chain.",
    "sectors": [
      {
        "name": "Hyperscalers / Platform Builders",
        "companies": [
          "Amazon (AWS)",
          "Google (Google Cloud / TPU)",
          "Microsoft (Azure / Maia)",
          "Meta",
          "OpenAI"
        ]
      },
      {
        "name": "ASIC Design & IP (The Architects & Tailors)",
        "companies": [
          "Broadcom",
          "Marvell Technology",
          "Alchip Technologies",
          "Socionext",
          "Faraday Technology",
          "Rambus",
          "Synopsys",
          "Cadence"
        ]
      },
      {
        "name": "Connectivity & Interconnect (The Veins)",
        "companies": [
          "Astera Labs",
          "Credo Technology",
          "Coherent",
          "Lumentum",
          "MACOM",
          "Ayar Labs"
        ]
      },
      {
        "name": "Power & Thermal (The Energy)",
        "companies": [
          "Monolithic Power Systems",
          "Vertiv Holdings",
          "Vicor",
          "nVent",
          "Modine",
          "Renesas",
          "Infineon"
        ]
      },
      {
        "name": "Manufacturing & Advanced Packaging (The Builders)",
        "companies": [
          "TSMC",
          "Amkor Technology",
          "Ibiden",
          "Unimicron",
          "Onto Innovation",
          "Camtek"
        ]
      },
      {
        "name": "Optics & Transceivers",
        "companies": [
          "Coherent",
          "Lumentum"
        ]
      }
    ]
  },
  "company_mapping": [
    {
      "company": "NVIDIA",
      "sector": "Accelerator Platform",
      "role": "Incumbent GPU platform provider and ecosystem anchor (CUDA)",
      "value_driver": "Existing market dominance sets the baseline TCO and ecosystem lock-in; hyperscaler shifts determine share reallocation.",
      "dependency_type": "platform",
      "beta_type": "medium"
    },
    {
      "company": "Amazon (AWS)",
      "sector": "Hyperscaler / Platform Builder",
      "role": "Customer and developer of in-house ASICs (Trainium, Inferentia) and driver of large-scale demand (Project Rainier)",
      "value_driver": "Directly generates demand across design partners, connectivity, power, and packaging as it scales Trainium/Inferentia deployments.",
      "dependency_type": "platform",
      "beta_type": "low"
    },
    {
      "company": "Google",
      "sector": "Hyperscaler / Platform Builder",
      "role": "Developer and adopter of TPU series and potential external cloud offering; architectural leader for bespoke silicon",
      "value_driver": "Continued TPU expansion drives demand for SerDes, IP, packaging and foundry services.",
      "dependency_type": "platform",
      "beta_type": "low"
    },
    {
      "company": "Microsoft",
      "sector": "Hyperscaler / Platform Builder",
      "role": "Developer of custom chips (Maia, Cobalt) and a hyperscaler customer for ecosystem suppliers",
      "value_driver": "Drive multi-cloud demand for design/IP partners and suppliers as Microsoft scales its ASIC strategy.",
      "dependency_type": "platform",
      "beta_type": "low"
    },
    {
      "company": "Meta",
      "sector": "Hyperscaler / Platform Builder",
      "role": "Developer and adopter of in-house AI accelerators (MTIA) and customer of design/IP suppliers",
      "value_driver": "Adds incremental demand for ASIC design partners and interconnect/power/cooling solutions.",
      "dependency_type": "platform",
      "beta_type": "low"
    },
    {
      "company": "OpenAI",
      "sector": "AI Platform / Developer",
      "role": "Potential in-house chip developer or buyer (discussed as partnering with Broadcom); a demand generator for specialized suppliers",
      "value_driver": "If it pursues custom silicon, it will create additional design and manufacturing demand for partners.",
      "dependency_type": "platform",
      "beta_type": "medium"
    },
    {
      "company": "Broadcom",
      "sector": "ASIC Design & IP",
      "role": "Provider of critical SerDes/IP and switch silicon; strategic design & production partner to hyperscalers",
      "value_driver": "SerDes and switch IP are prerequisites for high-performance ASICs and data center networking—broad, high-margin content-per-chip growth as hyperscalers scale.",
      "dependency_type": "direct",
      "beta_type": "medium"
    },
    {
      "company": "Marvell Technology",
      "sector": "ASIC Design & IP / Connectivity",
      "role": "Design/IP supplier and strategic partner to AWS/MS; provider of DSP, storage, security, and optical interconnect technology",
      "value_driver": "Long-term contracts with hyperscalers and the Celestial AI acquisition position Marvell to capture content growth across optical interconnect and DSP domains.",
      "dependency_type": "direct",
      "beta_type": "medium"
    },
    {
      "company": "Alchip Technologies",
      "sector": "ASIC Design & IP / Physical Design",
      "role": "Turnkey physical design, packaging management and production integration partner for AWS Trainium/Inferentia",
      "value_driver": "Direct, high-sensitivity revenue to AWS ASIC volume (Project Rainier); handles physicalization of hyperscaler designs at advanced nodes.",
      "dependency_type": "direct",
      "beta_type": "high"
    },
    {
      "company": "Socionext",
      "sector": "ASIC Design & IP",
      "role": "System semiconductor design partner for bespoke SoCs (data center and automotive)",
      "value_driver": "Niche wins on bespoke 3nm data center chips position it as a targeted beneficiary for customers seeking 'bespoke' solutions.",
      "dependency_type": "indirect",
      "beta_type": "medium"
    },
    {
      "company": "Faraday Technology",
      "sector": "ASIC Design & IP",
      "role": "Design house focused on ARM-based infrastructure and edge SoCs; design partner with foundry services",